{
  "schema_id": "forge-game://schemas/unreal-mcp-profile/1.0.0",
  "schema_version": "1.0.0",
  "profile_id": "unreal-editor-mcp-core",
  "profile_version": "1.0.0",
  "provider_id": "unreal-editor-model-context-protocol",
  "server_key": "unreal-mcp",
  "transport": "streamable_http",
  "endpoint": "http://127.0.0.1:8000/mcp",
  "negotiated_protocol": "2025-11-25",
  "host_tool_names": [
    "mcp__unreal-mcp__call_tool",
    "mcp__unreal_mcp__call_tool"
  ],
  "discovery_tools": ["list_toolsets", "describe_toolset"],
  "operations": [
    {"toolset_name": "EditorToolset.EditorAppToolset", "tool_name": "IsPIERunning", "action_id": "unreal.query", "target_argument_keys": []},
    {"toolset_name": "EditorToolset.EditorAppToolset", "tool_name": "GetSelectedAssets", "action_id": "unreal.query", "target_argument_keys": []},
    {"toolset_name": "EditorToolset.EditorAppToolset", "tool_name": "GetSelectedActors", "action_id": "unreal.query", "target_argument_keys": []},
    {"toolset_name": "EditorToolset.EditorAppToolset", "tool_name": "GetOpenAssets", "action_id": "unreal.query", "target_argument_keys": []},
    {"toolset_name": "EditorToolset.EditorAppToolset", "tool_name": "GetVisibleActors", "action_id": "unreal.query", "target_argument_keys": []},
    {"toolset_name": "editor_toolset.toolsets.asset.AssetTools", "tool_name": "exists", "action_id": "unreal.query", "target_argument_keys": ["path"]},
    {"toolset_name": "editor_toolset.toolsets.asset.AssetTools", "tool_name": "find_assets", "action_id": "unreal.query", "target_argument_keys": ["folder_path"]},
    {"toolset_name": "editor_toolset.toolsets.asset.AssetTools", "tool_name": "get_asset_class", "action_id": "unreal.query", "target_argument_keys": ["asset_path"]},
    {"toolset_name": "editor_toolset.toolsets.asset.AssetTools", "tool_name": "get_asset_tags", "action_id": "unreal.query", "target_argument_keys": ["asset_path"]},
    {"toolset_name": "editor_toolset.toolsets.asset.AssetTools", "tool_name": "get_metadata_tags", "action_id": "unreal.query", "target_argument_keys": ["asset_path"]},
    {"toolset_name": "editor_toolset.toolsets.asset.AssetTools", "tool_name": "get_dependencies", "action_id": "unreal.query", "target_argument_keys": ["asset_path"]},
    {"toolset_name": "editor_toolset.toolsets.asset.AssetTools", "tool_name": "get_referencers", "action_id": "unreal.query", "target_argument_keys": ["asset_path"]},
    {"toolset_name": "editor_toolset.toolsets.asset.AssetTools", "tool_name": "is_dirty", "action_id": "unreal.query", "target_argument_keys": ["asset_path"]},
    {"toolset_name": "editor_toolset.toolsets.asset.AssetTools", "tool_name": "can_edit_asset", "action_id": "unreal.query", "target_argument_keys": ["asset_path"]},
    {"toolset_name": "editor_toolset.toolsets.asset.AssetTools", "tool_name": "is_checked_out", "action_id": "unreal.query", "target_argument_keys": ["asset_path"]},
    {"toolset_name": "editor_toolset.toolsets.blueprint.BlueprintTools", "tool_name": "read_graph_dsl", "action_id": "unreal.query", "target_argument_keys": ["graph"]},
    {"toolset_name": "editor_toolset.toolsets.blueprint.BlueprintTools", "tool_name": "list_variables", "action_id": "unreal.query", "target_argument_keys": ["blueprint"]},
    {"toolset_name": "editor_toolset.toolsets.blueprint.BlueprintTools", "tool_name": "list_graphs", "action_id": "unreal.query", "target_argument_keys": ["blueprint"]},
    {"toolset_name": "editor_toolset.toolsets.blueprint.BlueprintTools", "tool_name": "get_graph", "action_id": "unreal.query", "target_argument_keys": ["blueprint"]},
    {"toolset_name": "editor_toolset.toolsets.blueprint.BlueprintTools", "tool_name": "get_parent", "action_id": "unreal.query", "target_argument_keys": ["blueprint"]},
    {"toolset_name": "editor_toolset.toolsets.scene.SceneTools", "tool_name": "get_current_level", "action_id": "unreal.query", "target_argument_keys": []},
    {"toolset_name": "editor_toolset.toolsets.scene.SceneTools", "tool_name": "find_actors", "action_id": "unreal.query", "target_argument_keys": ["root"]},
    {"toolset_name": "editor_toolset.toolsets.scene.SceneTools", "tool_name": "trace_world", "action_id": "unreal.query", "target_argument_keys": []},
    {"toolset_name": "editor_toolset.toolsets.object.ObjectTools", "tool_name": "get_properties", "action_id": "unreal.query", "target_argument_keys": ["instance"]},
    {"toolset_name": "editor_toolset.toolsets.object.ObjectTools", "tool_name": "list_properties", "action_id": "unreal.query", "target_argument_keys": ["instance"]},
    {"toolset_name": "editor_toolset.toolsets.object.ObjectTools", "tool_name": "get_class", "action_id": "unreal.query", "target_argument_keys": ["instance"]},
    {"toolset_name": "PluginToolset.PluginToolset", "tool_name": "ListEnabledPlugins", "action_id": "unreal.query", "target_argument_keys": []},
    {"toolset_name": "PluginToolset.PluginToolset", "tool_name": "GetPluginInfo", "action_id": "unreal.query", "target_argument_keys": []},
    {"toolset_name": "AutomationTestToolset.AutomationTestToolset", "tool_name": "DiscoverTests", "action_id": "unreal.query", "target_argument_keys": []},
    {"toolset_name": "AutomationTestToolset.AutomationTestToolset", "tool_name": "ListTests", "action_id": "unreal.query", "target_argument_keys": []},
    {"toolset_name": "AutomationTestToolset.AutomationTestToolset", "tool_name": "GetTestStatus", "action_id": "unreal.query", "target_argument_keys": []},
    {"toolset_name": "AutomationTestToolset.AutomationTestToolset", "tool_name": "GetTestResults", "action_id": "unreal.query", "target_argument_keys": []},
    {"toolset_name": "EditorToolset.LogsToolset", "tool_name": "GetLogEntries", "action_id": "unreal.query", "target_argument_keys": []},
    {"toolset_name": "EditorToolset.LogsToolset", "tool_name": "GetLogCategories", "action_id": "unreal.query", "target_argument_keys": []},
    {"toolset_name": "editor_toolset.toolsets.asset.AssetTools", "tool_name": "create_folder", "action_id": "unreal.mutate", "target_argument_keys": ["path"]},
    {"toolset_name": "editor_toolset.toolsets.asset.AssetTools", "tool_name": "duplicate", "action_id": "unreal.mutate", "target_argument_keys": ["path", "new_path"]},
    {"toolset_name": "editor_toolset.toolsets.asset.AssetTools", "tool_name": "move", "action_id": "unreal.mutate", "target_argument_keys": ["path", "new_path"]},
    {"toolset_name": "editor_toolset.toolsets.asset.AssetTools", "tool_name": "delete", "action_id": "unreal.mutate", "target_argument_keys": ["path"]},
    {"toolset_name": "editor_toolset.toolsets.asset.AssetTools", "tool_name": "update_metadata_tags", "action_id": "unreal.mutate", "target_argument_keys": ["asset_path"]},
    {"toolset_name": "editor_toolset.toolsets.asset.AssetTools", "tool_name": "save_assets", "action_id": "unreal.mutate", "target_argument_keys": ["asset_paths"]},
    {"toolset_name": "editor_toolset.toolsets.blueprint.BlueprintTools", "tool_name": "create", "action_id": "unreal.mutate", "target_argument_keys": ["folder_path", "asset_name"]},
    {"toolset_name": "editor_toolset.toolsets.blueprint.BlueprintTools", "tool_name": "write_graph_dsl", "action_id": "unreal.mutate", "target_argument_keys": ["graph"]},
    {"toolset_name": "editor_toolset.toolsets.blueprint.BlueprintTools", "tool_name": "compile_blueprint", "action_id": "unreal.mutate", "target_argument_keys": ["blueprint"]},
    {"toolset_name": "editor_toolset.toolsets.object.ObjectTools", "tool_name": "set_properties", "action_id": "unreal.mutate", "target_argument_keys": ["instance"]},
    {"toolset_name": "editor_toolset.toolsets.object.ObjectTools", "tool_name": "reset_properties", "action_id": "unreal.mutate", "target_argument_keys": ["instance"]}
  ]
}
